,nama,tweet
0,nay,dikittt review materi doang sm latsol tps
1,Twit Sosial,"Bahagia tak melulu soal materi, tapi kebersamaan bersama orang yang kita sayangilah yang lebih berarti"
2,Fauzi,"Ayo pendukung #Avalanche dari Indonesia, meriahkan yuk New Year Gala 2022  Event yang keren abis lho, pantengin youtubenya live jam 1 sore - 5 sore WIB yaa, kamu akan dapat materi yang sangat bermakna bersama belasan project pendukung #blockchain ini  Selengkapnya #AVAX $AVAX"
3,Jessika,baru mau buka eh mengandung materi sensitif
4,ğ‰ğ k'ia,"Hadeh 2 hari lagi sekolah, gue ngerasa kurang aja liburan. Gak ada 2 Minggu. Bukan apaÂ², cuman gue belum siap belajar di semester genap ini. Kayak ya ampun waktunya benerÂ² mepet banget. Mana materi S1 banyak yang gak paham."
5,cdfaninnd,"Latsol dikit, review materi jg"
6,nay,dikittt review materi doang sm latsol tps
7,Abdulanov Kholikov,Karna perempuannya yg jual diri? Jual memek demi materi dan gaya hidup
8,Twit Sosial,"Bahagia tak melulu soal materi, tapi kebersamaan bersama orang yang kita sayangilah yang lebih berarti"
9,DapurLetter,Materi dikirimkan ke:  http://dapurletter.webzinegmail.com  Alamat Pengiriman Materi fisik (album/poster/flyer) :
10,Fauzi,"Ayo pendukung #Avalanche dari Indonesia, meriahkan yuk New Year Gala 2022  Event yang keren abis lho, pantengin youtubenya live jam 1 sore - 5 sore WIB yaa, kamu akan dapat materi yang sangat bermakna bersama belasan project pendukung #blockchain ini  Selengkapnya #AVAX $AVAX"
11,Avalanche Indonesia,"AVAngers Indonesia!   Jangan lewatkan ""New Year Gala 2022"" yang live secara bersamaan di semua komunitas #Avalanche Asia   bersama 15 Proyek Menjanjikan di Ekosistem Avalanche  Stay tuned terus di  https://t.me/avalanche_id untuk info selanjutnya!  #AVATAR #AVAX "
12,Jessika,baru mau buka eh mengandung materi sensitif
13,ğ‘¨ğ’” ğ‘°ğ’ğ’“ğ’‚ğ’ ğ‘²ğ’‰ğ’‚ğ’Šğ’•ğ’‚ğ’ğ’š ğ‘«ğ’‚ğ’–ğ’ğ’‚ğ’š,"Sesuai materi press confrens , jelas dinyatakan ada . Gak main main ."
14,ğ‰ğ k'ia,"Hadeh 2 hari lagi sekolah, gue ngerasa kurang aja liburan. Gak ada 2 Minggu. Bukan apaÂ², cuman gue belum siap belajar di semester genap ini. Kayak ya ampun waktunya benerÂ² mepet banget. Mana materi S1 banyak yang gak paham."
15,kecebong 17,"Menggalau dan sakit hati sepertinya tindakan bodoh, cukup berbuat yang terbaik, magnet cinta itu materi."
16,pastibisaÂ²Â²,"Mau kak...aku pengen buku kampung soal Simak ui nya kak, Alasannya karena aku angkatan 22 yang sekarang lagi nyicil materi utbk kak dan kebetulan aku linjur dan butuh buku ini untuk latihan soal kak supaya terbiasa dalam menghadapi soal, Semoga buku ini rezeki ku bismillah..."
17,love,"tapi anehnya otak gue lancar bgt kalo ingett +30 long au sehari, giliran materi demi tuhan susah amatttttt"
18,Dedek,"Paktua...di atas semuanya .. pelacur yg ternista... adl jenis anda.. Pelacur politik.. pelacur agama... pelacur keadaan Semua hal anda jd kan ""materi"" lewat kontenÂ² anda yg amat sangat berbahaya bagi perdamaian negeri ini Anda lah pelacur sejati nya, paktua Nista!  Salam"
19,Kode Diskon : PFMHARVARD,Materi prioritas nder
